movieId,content
1,The foot soldiers of the early feminist movement, women who were forced underground to pursue a dangerous game of cat and mouse with an increasingly brutal State.
2,A seemingly perfect family looks to fix their problems with the help of Miss Clara, an older, wiser woman.
3,Identical twin gangsters Ronald and Reginald Kray terrorize London during the 1960s.
4,Two teenage boys unwittingly summon an ancient evil entity known as The Blind One by delving into black magic while trying to escape their mundane lives.
5,A fictitious love story loosely inspired by the lives of Danish artists Lili Elbe and Gerda Wegener. Lili and Gerda's marriage and work evolve as they navigate Lili's groundbreaking journey as a transgender pioneer.
6,A punk rock band is forced to fight for survival after witnessing a murder at a neo-Nazi skinhead bar.
7,The Dress is a tale filled with sex, violence, comedy and drama as it follows the life of a dress. Conceived under a cloud of frustration and despair, the dress serves as the hub in a great wheel of misfortune in an extraordinary sequence of events that envelopes both the dress and those fatefully drawn into its universe.
8,A drama based on the experiences of Agu, a child soldier fighting in the civil war of an unnamed African country.
9,Riley searches for a cure to the virus that took over Samantha before it consumes him and the entire world.
10,In the small Central California town where they grew up, two estranged gay brothers struggle to reconnect after the recent death of their father.
11,Moving into a beach house involves Lynn Markham in mystery, danger, and romance with a beach boy of dubious motives.
12,A drama centered on the relationship between a young man and a transsexual who is transitioning from female to male.
13,A documentary that utilizes hundreds of hours of audio that Marlon Brando recorded over the course of his life to tell the screen legend's story.
14,On Christmas eve, three lifelong friends spend the night in New York City looking for the Holy Grail of Christmas parties.
15,A climbing expedition on Mt. Everest is devastated by a severe snow storm.
